{
  "manifestVersion": "OX-SD15-EXTERNAL-VAE-ARTIFACT-1",
  "modelId": "OX-MODEL-002",
  "componentId": "OX-MODEL-002-VAE-FP16-1",
  "state": "ACQUIRED_AND_VERIFIED",
  "source": {
    "provider": "HUGGING_FACE",
    "repository": "stable-diffusion-v1-5/stable-diffusion-v1-5",
    "revision": "451f4fe16113bff5a5d2269ed5ad43b0592e9a14",
    "filename": "vae/diffusion_pytorch_model.fp16.safetensors",
    "license": "CreativeML OpenRAIL-M",
    "gated": false
  },
  "artifact": {
    "path": "models/sd15/vae/sd15-official-vae-fp16.safetensors",
    "format": "safetensors",
    "precision": "FP16",
    "sizeBytes": 167335342,
    "sha256": "sha256:4fbcf0ebe55a0984f5a5e00d8c4521d52359af7229bb4d81890039d2aa16dd7c"
  },
  "approval": {
    "manualApprovalPresent": true,
    "approvalPhraseAccepted": true,
    "approvalPhrase": "I APPROVE OX-MODEL-002 SD15 FP16 VAE ARTIFACT DOWNLOAD"
  },
  "verification": {
    "sizeVerified": true,
    "sha256Verified": true,
    "sourceRevisionPinned": true,
    "licenseRecorded": true,
    "verifiedAt": "2026-10-12T23:17:09.221490+00:00"
  },
  "governance": {
    "downloadCompleted": true,
    "executionAllowed": false,
    "preflightRequired": true,
    "genesisRetryAllowed": false,
    "canonicalizationAllowed": false,
    "nextTokenAllowed": false,
    "nextBatchAllowed": false
  }
}
